{
  "artifact_type": "LEGACY_DISPOSITION_DECISION_SET",
  "decision_set_version": 2,
  "decision_set_id": "PHASE1F_EXACT_TRANSITION_FIXTURE_DECISIONS",
  "owner": "WEB_BRAIN",
  "source_mapping_set_id": "PHASE1F_EXACT_TRANSITION_FIXTURE_MAPPING",
  "source_mapping_set_digest": "d0e632c2aaaac32c3b644e94335b53405da4b86a020f916242526b162ccb4c86",
  "generator_may_modify": false,
  "decision_scope": "TEST_FIXTURE_ONLY_NOT_CURRENT_LEGACY_INSTANCE",
  "decisions": [
    {
      "decision_id": "LDD::FIXTURE_BRAIN_FIRST_RULE",
      "old_rule_id": "FIXTURE_BRAIN_FIRST_RULE",
      "owner": "WEB_BRAIN",
      "decision": "RETIRE",
      "basis": "TECHNICAL_DUPLICATION_ANALYSIS",
      "decision_ref": "FIXTURE_BRAIN_CONFIRMED_DUPLICATION",
      "user_decision_ref": null,
      "affects_product_requirement": "NO",
      "affects_important_tradeoff": "NO",
      "product_direction_effect": "PRESERVES_CONFIRMED_DIRECTION",
      "rationale": "Exact fixture semantics are fully preserved by the current target rule; this is mechanism evidence only."
    }
  ],
  "decision_set_digest": "7011e093fb82b1c598f41f756ea38c65b98c75f81765a613c441eabe0aca9be1"
}
